{
  "schemaVersion": "0.1.0",
  "meta": {
    "sourceApp": "f-mail",
    "importedFrom": "chrysalis.webir.bundle@1.0.0",
    "chrysalisVersion": "test",
    "createdAt": "1970-01-01T00:00:00.000Z"
  },
  "roots": [
    "m0"
  ],
  "nodes": [
    {
      "id": "m0",
      "layer": "effect",
      "op": "mail.send",
      "valueType": {
        "kind": "void"
      },
      "effects": [
        {
          "kind": "mail.send"
        }
      ],
      "operandIds": [],
      "attrs": {
        "to": "user@example.com",
        "origin": {
          "kind": "php",
          "file": "m.php",
          "line": 1,
          "col": 1
        }
      },
      "provenance": [
        {
          "source": "php-ast",
          "reason": "mail",
          "locator": {
            "kind": "php",
            "file": "m.php",
            "line": 1,
            "col": 1
          }
        }
      ],
      "webir": {
        "dialect": "effect",
        "op": "mail.send",
        "nodeId": "m0"
      }
    }
  ],
  "losses": []
}
